{"$schema":"https://json-schema.org/draft/2020-12/schema","$id":"vss.movie.story_fragment/1","type":"object","additionalProperties":false,"required":["schema_version","contract_identity","contract_version","fragment_id","project_id","classification","trust","purpose","payload"],"properties":{"schema_version":{"const":"1"},"contract_identity":{"const":"story_fragment"},"contract_version":{"const":"1"},"fragment_id":{"type":"string","pattern":"^[a-z][a-z0-9._:-]{0,127}$"},"project_id":{"type":"string","pattern":"^[a-z][a-z0-9._:-]{0,63}$"},"classification":{"enum":["public","internal"]},"trust":{"enum":["approved_fixture","unverified"]},"purpose":{"const":"scene_breakdown_local_validation"},"payload":{"type":"object","additionalProperties":false,"required":["title","fragment_text","language","source_type","source_sequence","declared_characters","declared_locations","citations","source_qualification","rights_qualification","cultural_qualification"],"properties":{"title":{"type":"string","minLength":1,"maxLength":256},"fragment_text":{"type":"string","minLength":1,"maxLength":8192},"language":{"const":"en"},"source_type":{"enum":["prose_fragment","structured_scene_fragment"]},"source_sequence":{"type":"integer","minimum":1,"maximum":100000},"declared_characters":{"type":"array","maxItems":32,"uniqueItems":true,"items":{"type":"string","pattern":"^[a-z][a-z0-9._:-]{0,63}$"}},"declared_locations":{"type":"array","maxItems":16,"uniqueItems":true,"items":{"type":"string","pattern":"^[a-z][a-z0-9._:-]{0,63}$"}},"citations":{"type":"array","maxItems":16,"uniqueItems":true,"items":{"type":"string","pattern":"^[a-z][a-z0-9._:-]{0,127}$"}},"source_qualification":{"enum":["source_declared","source_observed","mixed_or_unknown"]},"rights_qualification":{"enum":["original","public_domain_claimed","explicitly_authorized","unknown"]},"cultural_qualification":{"enum":["fictional","historical_claim","legendary","literary_adaptation","religious_or_cultural_source","mixed_or_unknown"]}}}}}
