{"schema_version":"1","contract_identity":"story_fragment","contract_version":"1","fragment_id":"fragment-opening-001","project_id":"movie-local","classification":"public","trust":"approved_fixture","purpose":"scene_breakdown_local_validation","payload":{"title":"The Lantern at Dawn","fragment_text":"At dawn, Mira crosses the quiet courtyard and finds a lantern beside the locked gate.","language":"en","source_type":"prose_fragment","source_sequence":1,"declared_characters":["mira"],"declared_locations":["courtyard"],"citations":["fixture-original-1"],"source_qualification":"source_declared","rights_qualification":"original","cultural_qualification":"fictional"}}
