{"schema_version":"1","contract_identity":"story_fragment","contract_version":"1","fragment_id":"fragment-vikramaditya-opening-001","project_id":"vikramaditya-local","classification":"public","trust":"approved_fixture","purpose":"scene_breakdown_local_validation","payload":{"title":"Vikramaditya and the Banyan Riddle","fragment_text":"SCENE: At dawn, Vikramaditya pauses beneath the banyan tree as the vetala's riddle interrupts the road to Ujjayini.","language":"en","source_type":"structured_scene_fragment","source_sequence":1,"declared_characters":["vikramaditya","vetala"],"declared_locations":["banyan-road","ujjayini"],"citations":["fixture-original-vikramaditya-001"],"source_qualification":"source_declared","rights_qualification":"original","cultural_qualification":"legendary"}}
